{
  "schema_version": 1,
  "task_id": "p15_v2_duplicate_semantics_010",
  "task": {
    "project_id": "eleven_capture",
    "prompt": "eleven_capture için duplicate semantics bağlamında güvenli aktif kararı seç.",
    "intent": [
      "review"
    ],
    "domains": [
      "duplicate_semantics",
      "reliability"
    ]
  },
  "expected_context": {
    "required": [
      "mem_ec_atomic_rename"
    ],
    "useful": [
      "mem_explicit_decision"
    ],
    "forbidden": [
      "mem_pg_redis_cache",
      "mem_ec_resolved_json_cache"
    ]
  },
  "expected_behavior": {
    "wrong_project_allowed": false,
    "inactive_allowed": false
  },
  "expectations": {
    "authority_resolution": "future",
    "conflict_resolution": "future",
    "ask_user": false,
    "abstain": false
  }
}
