{
  "schema_version": 1,
  "task_id": "p15_lifecycle_013",
  "task": {
    "project_id": "eleven_capture",
    "prompt": "Use active eleven_capture state while excluding completed lifecycle records 13.",
    "intent": [
      "lifecycle"
    ],
    "domains": [
      "memory-lifecycle"
    ]
  },
  "expected_context": {
    "required": [
      "mem_ec_vault_manifest"
    ],
    "useful": [
      "mem_stale_projection"
    ],
    "forbidden": [
      "mem_superseded_save_rule",
      "mem_ec_resolved_json_cache"
    ]
  },
  "expected_behavior": {
    "wrong_project_allowed": false,
    "inactive_allowed": false
  }
}
