{
  "schema_version": 1,
  "task_id": "p15_relevance_023",
  "task": {
    "project_id": "promtgen",
    "prompt": "Select the reliable persistence rule for promtgen relevance scenario 23.",
    "intent": [
      "architecture"
    ],
    "domains": [
      "reliability"
    ]
  },
  "expected_context": {
    "required": [
      "mem_pg_indexeddb_backup"
    ],
    "useful": [
      "mem_stale_projection"
    ],
    "forbidden": [
      "mem_mc_command_policy",
      "mem_pg_old_localstorage"
    ]
  },
  "expected_behavior": {
    "wrong_project_allowed": false,
    "inactive_allowed": false
  }
}
