{
  "schema_version": 1,
  "task_id": "p15_ambiguity_004",
  "task": {
    "project_id": null,
    "prompt": "Answer only from global policy while current project is ambiguous 4.",
    "intent": [
      "ambiguity"
    ],
    "domains": [
      "scope"
    ]
  },
  "expected_context": {
    "required": [
      "mem_restore_rebuild"
    ],
    "useful": [
      "mem_default_scope"
    ],
    "forbidden": [
      "mem_ec_local_cache",
      "mem_pg_template_contract",
      "mem_mc_event_stream",
      "mem_legacy_export"
    ]
  },
  "expected_behavior": {
    "wrong_project_allowed": false,
    "inactive_allowed": false
  }
}
