{
  "schema_version": 1,
  "task_id": "p15_project_isolation_016",
  "task": {
    "project_id": "eleven_capture",
    "prompt": "Retrieve only eleven_capture context for isolation scenario 16.",
    "intent": [
      "scope"
    ],
    "domains": [
      "project-isolation"
    ]
  },
  "expected_context": {
    "required": [
      "mem_markdown_before_sqlite"
    ],
    "useful": [
      "mem_default_scope"
    ],
    "forbidden": [
      "mem_promtgen_storage",
      "mem_legacy_export",
      "mem_ec_resolved_json_cache"
    ]
  },
  "expected_behavior": {
    "wrong_project_allowed": false,
    "inactive_allowed": false
  }
}
