{
  "schema_version": 1,
  "task_id": "p15_v2_noise_heavy_008",
  "task": {
    "project_id": "promtgen",
    "prompt": "Select only active promtgen context for the noise heavy evaluation case.",
    "intent": [
      "review"
    ],
    "domains": [
      "noise_heavy",
      "reliability"
    ]
  },
  "expected_context": {
    "required": [
      "mem_pg_indexeddb_backup"
    ],
    "useful": [
      "mem_backup_canonical"
    ],
    "forbidden": [
      "mem_mc_event_stream",
      "mem_pg_resolved_cdn"
    ]
  },
  "expected_behavior": {
    "wrong_project_allowed": false,
    "inactive_allowed": false
  },
  "expectations": {
    "authority_resolution": "future",
    "conflict_resolution": "future",
    "ask_user": false,
    "abstain": false
  }
}
