{
  "schema_version": 1,
  "task_id": "p15_project_isolation_002",
  "task": {
    "project_id": "promtgen",
    "prompt": "Retrieve only promtgen context for isolation scenario 2.",
    "intent": [
      "scope"
    ],
    "domains": [
      "project-isolation"
    ]
  },
  "expected_context": {
    "required": [
      "mem_pg_prompt_versioning"
    ],
    "useful": [
      "mem_default_scope"
    ],
    "forbidden": [
      "mem_mc_world_backup",
      "mem_legacy_export",
      "mem_pg_resolved_cdn"
    ]
  },
  "expected_behavior": {
    "wrong_project_allowed": false,
    "inactive_allowed": false
  }
}
