{
  "schema_version": 1,
  "task_id": "p15_persistence_001",
  "task": {
    "project_id": "eleven_capture",
    "prompt": "Quick Note kaydetme akışında Markdown ve SQLite write ordering nasıl olmalı?",
    "intent": [
      "architecture",
      "persistence"
    ],
    "domains": [
      "filesystem",
      "sqlite",
      "reliability"
    ]
  },
  "expected_context": {
    "required": [
      "mem_markdown_source_of_truth",
      "mem_markdown_before_sqlite"
    ],
    "useful": [
      "mem_windows_target"
    ],
    "forbidden": [
      "mem_promtgen_storage",
      "mem_superseded_save_rule"
    ]
  },
  "expected_behavior": {
    "wrong_project_allowed": false,
    "inactive_allowed": false
  },
  "expectations": {
    "authority_resolution": "future",
    "conflict_resolution": "future",
    "ask_user": false,
    "abstain": false
  }
}
