{
  "schema_version": 1,
  "task_id": "p15_relevance_005",
  "task": {
    "project_id": "promtgen",
    "prompt": "Select the reliable persistence rule for promtgen relevance scenario 5.",
    "intent": [
      "architecture"
    ],
    "domains": [
      "reliability"
    ]
  },
  "expected_context": {
    "required": [
      "mem_pg_redis_cache"
    ],
    "useful": [
      "mem_default_scope"
    ],
    "forbidden": [
      "mem_mc_protocol_version",
      "mem_pg_old_localstorage"
    ]
  },
  "expected_behavior": {
    "wrong_project_allowed": false,
    "inactive_allowed": false
  }
}
