{
  "schema_version": 1,
  "task_id": "p15_v2_basic_relevance_030",
  "task": {
    "project_id": "minecraft_mcp",
    "prompt": "minecraft_mcp scope içinde basic relevance decision'ını değerlendir; foreign context kullanma.",
    "intent": [
      "review"
    ],
    "domains": [
      "basic_relevance",
      "reliability"
    ]
  },
  "expected_context": {
    "required": [
      "mem_mc_world_backup"
    ],
    "useful": [
      "mem_atomic_replace"
    ],
    "forbidden": [
      "mem_ec_atomic_rename",
      "mem_mc_resolved_polling"
    ]
  },
  "expected_behavior": {
    "wrong_project_allowed": false,
    "inactive_allowed": false
  },
  "expectations": {
    "authority_resolution": "future",
    "conflict_resolution": "future",
    "ask_user": false,
    "abstain": false
  }
}
