{
  "schema_version": 1,
  "task_id": "p15_v2_secret_forbidden_015",
  "task": {
    "project_id": "minecraft_mcp",
    "prompt": "minecraft_mcp scope içinde secret forbidden decision'ını değerlendir; foreign context kullanma.",
    "intent": [
      "architecture"
    ],
    "domains": [
      "secret_forbidden",
      "reliability"
    ]
  },
  "expected_context": {
    "required": [
      "mem_secret_redaction"
    ],
    "useful": [
      "mem_markdown_source_of_truth"
    ],
    "forbidden": [
      "mem_ec_atomic_rename",
      "mem_mc_old_websocket"
    ]
  },
  "expected_behavior": {
    "wrong_project_allowed": false,
    "inactive_allowed": false
  },
  "expectations": {
    "authority_resolution": "future",
    "conflict_resolution": "future",
    "ask_user": false,
    "abstain": false
  }
}
