{
  "schema_version": 1,
  "task_id": "p15_v2_authority_traps_012",
  "task": {
    "project_id": "minecraft_mcp",
    "prompt": "minecraft_mcp scope içinde authority traps decision'ını değerlendir; foreign context kullanma.",
    "intent": [
      "review"
    ],
    "domains": [
      "authority_traps",
      "reliability"
    ]
  },
  "expected_context": {
    "required": [
      "mem_mc_event_stream"
    ],
    "useful": [
      "mem_schema_version"
    ],
    "forbidden": [
      "mem_ec_sqlite_index",
      "mem_mc_resolved_polling"
    ]
  },
  "expected_behavior": {
    "wrong_project_allowed": false,
    "inactive_allowed": false
  },
  "expectations": {
    "authority_resolution": "future",
    "conflict_resolution": "future",
    "ask_user": false,
    "abstain": false
  }
}
