{
  "schema_version": 1,
  "task_id": "p15_ambiguity_003",
  "task": {
    "project_id": null,
    "prompt": "Answer only from global policy while current project is ambiguous 3.",
    "intent": [
      "ambiguity"
    ],
    "domains": [
      "scope"
    ]
  },
  "expected_context": {
    "required": [
      "mem_file_lock"
    ],
    "useful": [
      "mem_restore_rebuild"
    ],
    "forbidden": [
      "mem_ec_vault_manifest",
      "mem_pg_indexeddb_backup",
      "mem_mc_command_policy",
      "mem_legacy_export"
    ]
  },
  "expected_behavior": {
    "wrong_project_allowed": false,
    "inactive_allowed": false
  }
}
