{
  "schema_version": 1,
  "task_id": "p15_v2_authority_traps_041",
  "task": {
    "project_id": "promtgen",
    "prompt": "Select only active promtgen context for the authority traps evaluation case.",
    "intent": [
      "architecture"
    ],
    "domains": [
      "authority_traps",
      "reliability"
    ]
  },
  "expected_context": {
    "required": [
      "mem_promtgen_storage"
    ],
    "useful": [
      "mem_no_network"
    ],
    "forbidden": [
      "mem_mc_protocol_version",
      "mem_pg_old_localstorage"
    ]
  },
  "expected_behavior": {
    "wrong_project_allowed": false,
    "inactive_allowed": false
  },
  "expectations": {
    "authority_resolution": "future",
    "conflict_resolution": "future",
    "ask_user": false,
    "abstain": false
  }
}
