{
  "schema_version": 1,
  "task_id": "p15_supersession_010",
  "task": {
    "project_id": "promtgen",
    "prompt": "Resolve the authoritative replacement rule for promtgen scenario 10.",
    "intent": [
      "supersession"
    ],
    "domains": [
      "authority"
    ]
  },
  "expected_context": {
    "required": [
      "mem_pg_template_contract"
    ],
    "useful": [
      "mem_explicit_decision"
    ],
    "forbidden": [
      "mem_pg_resolved_cdn"
    ]
  },
  "expected_behavior": {
    "wrong_project_allowed": false,
    "inactive_allowed": false
  }
}
